[
  {
    "id": "paper:contract-net",
    "type": "paper",
    "title": "The Contract Net Protocol: High-Level Communication and Control in a Distributed Problem Solver",
    "url": "https://doi.org/10.1109/TC.1980.1675516",
    "authors": ["Reid G. Smith"],
    "organizations": [],
    "publishedAt": "1980-12-01",
    "summary": "Introduces announcement, bidding, award, and execution messages for decentralized task allocation among problem-solving nodes.",
    "whyNotable": "Established a durable market-like delegation primitive that still clarifies manager-contractor and capability-based routing designs.",
    "primaryTheme": "foundations",
    "themes": ["foundations", "allocation", "communication"],
    "techniques": ["contract-net", "capability-delegation", "negotiation"],
    "evidence": {
      "status": "peer-reviewed",
      "maturity": "conceptual",
      "limitations": "Predates language-model agents and assumes structured tasks, messages, and locally meaningful bids."
    },
    "artifacts": [],
    "lifecycle": { "status": "historical" },
    "curation": {
      "tier": "essential",
      "addedAt": "2026-08-25",
      "lastReviewedAt": "2026-08-25"
    }
  },
  {
    "id": "paper:blackboard-architecture",
    "type": "paper",
    "title": "A Blackboard Architecture for Control",
    "url": "https://doi.org/10.1016/0004-3702(85)90063-3",
    "authors": ["Barbara Hayes-Roth"],
    "organizations": [],
    "publishedAt": "1985-07-01",
    "summary": "Describes opportunistic coordination through a shared blackboard whose evolving state activates specialized knowledge sources.",
    "whyNotable": "Provides the conceptual ancestor of shared-artifact and event-driven agent systems where coordination happens through durable state rather than chat alone.",
    "primaryTheme": "foundations",
    "themes": ["foundations", "architectures", "state"],
    "techniques": ["blackboard", "shared-artifacts", "shared-memory"],
    "evidence": {
      "status": "peer-reviewed",
      "maturity": "conceptual",
      "limitations": "The architecture does not by itself solve distributed consistency, access control, or language-model reliability."
    },
    "artifacts": [],
    "lifecycle": { "status": "historical" },
    "curation": {
      "tier": "essential",
      "addedAt": "2026-08-25",
      "lastReviewedAt": "2026-08-25"
    }
  },
  {
    "id": "paper:sharedplans",
    "type": "paper",
    "title": "Collaborative Plans for Complex Group Action",
    "url": "https://doi.org/10.1016/0004-3702(95)00103-4",
    "authors": ["Barbara J. Grosz", "Sarit Kraus"],
    "organizations": [],
    "publishedAt": "1996-10-01",
    "summary": "Formalizes partial shared plans, intentions, commitments, and communication requirements for collaborative group action.",
    "whyNotable": "Separates merely assigning subtasks from maintaining the mutual commitments and beliefs required for genuine teamwork.",
    "primaryTheme": "foundations",
    "themes": ["foundations", "allocation", "communication"],
    "techniques": ["joint-intentions", "task-decomposition", "human-in-the-loop"],
    "evidence": {
      "status": "peer-reviewed",
      "maturity": "conceptual",
      "limitations": "Its formal intentional model is difficult to instantiate faithfully in probabilistic language-model agents."
    },
    "artifacts": [],
    "lifecycle": { "status": "historical" },
    "curation": {
      "tier": "essential",
      "addedAt": "2026-08-25",
      "lastReviewedAt": "2026-08-25"
    }
  },
  {
    "id": "paper:dec-pomdp-complexity",
    "type": "paper",
    "title": "The Complexity of Decentralized Control of Markov Decision Processes",
    "url": "https://doi.org/10.1287/moor.27.4.819.297",
    "authors": ["Daniel S. Bernstein", "Robert Givan", "Neil Immerman", "Shlomo Zilberstein"],
    "organizations": [],
    "publishedAt": "2002-11-01",
    "summary": "Formalizes decentralized partially observable decision processes and proves severe worst-case complexity for joint policy computation.",
    "whyNotable": "Explains why decentralized coordination under partial information is structurally harder than solving independent single-agent problems.",
    "primaryTheme": "foundations",
    "themes": ["foundations", "architectures", "evaluation"],
    "techniques": ["dec-pomdp", "peer-to-peer", "coordination-benchmarking"],
    "evidence": {
      "status": "peer-reviewed",
      "maturity": "conceptual",
      "limitations": "The formal state and observation models do not capture the open-ended semantics of modern language-agent environments."
    },
    "artifacts": [],
    "lifecycle": { "status": "historical" },
    "curation": {
      "tier": "essential",
      "addedAt": "2026-08-25",
      "lastReviewedAt": "2026-08-25"
    }
  },
  {
    "id": "spec:fipa-acl",
    "type": "specification",
    "title": "FIPA Agent Communication Language Specifications",
    "url": "https://www.fipa.org/repository/aclspecs.html",
    "authors": [],
    "organizations": ["Foundation for Intelligent Physical Agents"],
    "publishedAt": "2002-12-01",
    "summary": "Standardizes communicative acts, message structure, conversation identifiers, content languages, and interaction protocols for heterogeneous agents.",
    "whyNotable": "Supplies the historical standards baseline for performatives, directories, Contract Net, auctions, and semantically explicit agent messages.",
    "primaryTheme": "communication",
    "themes": ["foundations", "communication", "allocation"],
    "techniques": ["interoperability", "contract-net", "negotiation"],
    "evidence": {
      "status": "historical-standard",
      "maturity": "implemented",
      "limitations": "Formal mental-state semantics proved difficult to verify and the specifications predate current web-native agent protocols."
    },
    "artifacts": [
      { "kind": "specification", "url": "https://www.fipa.org/repository/aclspecs.html" }
    ],
    "lifecycle": { "status": "historical" },
    "curation": {
      "tier": "essential",
      "addedAt": "2026-08-25",
      "lastReviewedAt": "2026-08-25"
    }
  },
  {
    "id": "paper:learning-to-communicate",
    "type": "paper",
    "title": "Learning to Communicate with Deep Multi-Agent Reinforcement Learning",
    "url": "https://papers.neurips.cc/paper/6042-learning-to-communicate-with-deep-multi-agent-reinforcement-learning",
    "authors": ["Jakob N. Foerster", "Yannis M. Assael", "Nando de Freitas", "Shimon Whiteson"],
    "organizations": [],
    "publishedAt": "2016-12-01",
    "summary": "Introduces RIAL and DIAL, allowing agents to learn communication protocols under centralized learning and decentralized execution.",
    "whyNotable": "Made the communication channel itself learnable and established a major bridge between multi-agent reinforcement learning and coordination design.",
    "primaryTheme": "foundations",
    "themes": ["foundations", "communication", "architectures"],
    "techniques": ["learned-communication", "centralized-training-decentralized-execution"],
    "evidence": {
      "status": "peer-reviewed",
      "maturity": "evaluated",
      "limitations": "Experiments use small synthetic environments and learned signals that do not directly transfer to open natural-language protocols."
    },
    "artifacts": [],
    "lifecycle": { "status": "historical" },
    "curation": {
      "tier": "strong",
      "addedAt": "2026-08-25",
      "lastReviewedAt": "2026-08-25"
    }
  },
  {
    "id": "paper:qmix",
    "type": "paper",
    "title": "QMIX: Monotonic Value Function Factorisation for Deep Multi-Agent Reinforcement Learning",
    "url": "https://proceedings.mlr.press/v80/rashid18a.html",
    "authors": ["Tabish Rashid", "Mikayel Samvelyan", "Christian Schroeder de Witt", "Gregory Farquhar", "Jakob Foerster", "Shimon Whiteson"],
    "organizations": [],
    "publishedAt": "2018-07-01",
    "summary": "Factorizes a centralized action-value function into monotonic per-agent values that support decentralized action selection.",
    "whyNotable": "Provides a canonical example of training with global coordination information while preserving decentralized execution at run time.",
    "primaryTheme": "foundations",
    "themes": ["foundations", "architectures", "evaluation"],
    "techniques": ["centralized-training-decentralized-execution", "hierarchical-control"],
    "evidence": {
      "status": "peer-reviewed",
      "maturity": "evaluated",
      "limitations": "Monotonic value factorization restricts the class of joint value functions and targets cooperative reinforcement-learning tasks rather than language agents."
    },
    "artifacts": [
      { "kind": "code", "url": "https://github.com/oxwhirl/pymarl" }
    ],
    "lifecycle": { "status": "historical" },
    "curation": {
      "tier": "strong",
      "addedAt": "2026-08-25",
      "lastReviewedAt": "2026-08-25"
    }
  },
  {
    "id": "paper:camel",
    "type": "paper",
    "title": "CAMEL: Communicative Agents for Mind Exploration of Large Scale Language Model Society",
    "url": "https://proceedings.neurips.cc/paper_files/paper/2023/hash/a3621ee907def47c1b952ade25c67698-Abstract-Conference.html",
    "authors": ["Guohao Li", "Hasan Abed Al Kader Hammoud", "Hani Itani", "Dmitrii Khizbullin", "Bernard Ghanem"],
    "organizations": [],
    "publishedAt": "2023-03-31",
    "summary": "Uses role-playing and inception prompting to sustain cooperative interaction between language-model agents with assigned roles.",
    "whyNotable": "Became an influential early template for role-conditioned LLM societies and for studying conversational cooperation at scale.",
    "primaryTheme": "architectures",
    "themes": ["architectures", "communication", "allocation"],
    "techniques": ["role-specialization", "peer-to-peer", "capability-delegation"],
    "evidence": {
      "status": "peer-reviewed",
      "maturity": "evaluated",